Salvia sylvestris|May Night|Perennial|3-9|Late May - June (Early to mid-summer)|Full sun, drought resistant|Any soil, but must be well draining, does not tolerate soggy winter soil|Rosettes can be removed in early spring|Height: 18”, Spread: 18”, Clumping|None|Butterflies and Hummingbirds|Deer and rabbits|Blooms first year|Long lived|Difficult to grow from seed. Will flower late first year, and return strong next year. Remove spent flowers to promote reblooming|
Sedum varieties|Stonecrop|Perennial|4-9|June-August|Full sun, partial shade|Well draining soil, drought resistant, no fertilizer needed, water only when soil is chalky dry|Any time|Height: 4”, Spread: Sprawling|None|Butterflies|Deer and rabbits||Long lived|Evergreen, good in containers, rockwalls, creavasses, groundcover, good for draping over edges of pots, rocks or steep hillsides|Sedum forsterianum 'Oracle'; yellow flowers:Sedum sexangulare; yellow flowers:Sedum spurium 'Coccineum'; pink flowers:Sedum spurium 'Summer Glory'; red/dark pink
Stachys byzantina|Lamb's Ear|Perennial|4-8|June and July|Full sun|Dry soil, low fertility, drought resistant|Early spring; when rosette has several small roots, cut rosette free with scissors|Height: 4-6” (18” with flower stalk) Spread: 6-12” Spreading; produces rosettes|Sweet|Bees|Deer and rabbits|Flowers second year|Long lived|Tolerates black walnut trees|
Thymus citriodorus|Citrus Thyme|Edible perennial|5-10|June|Full sun|Any soil, do not overwater (turns yellow)|Prefers not to be divided, easy to make cuttings and soak in water to start new plants|Height: 6-8”, Spread: 8”, Clumping|Citrus Thyme|Butterflies and bees|Deer and rabbits||Rejuvenate by starting new plants from cuttings, or by lifting plant sprigs and adding leafy compost underneath. Sprigs will grow new roots and rejuvenate plant|Excellent for chicken and beef or vegetable casseroles. Has a citrus aftertaste. Use three to four sprigs per recipe. Can also be used to make tea. Plant grown organically|
Vernonia noveboracensis|New York Ironweed|Perennial|3-9|July|Part shade to full sun|Any soil|Can be transplanted when less than 1 foot tall|Height: 4-6’, Spread: 12”, Clumping, spreading by rosettes, but after many years|Sweet|Bees and Butterflies|Deer and rabbits|Three years until full height, might bloom first year, but definitely second year. Slow to come up in spring, breaks ground early June|Long lived; small first year, spends most of its energy setting roots|Very difficult to grow from seed. Prefers afternoon shade from sun. May sag in full heat of summer, but recovers in the evening. Monarch magnet|
Veronica spicata|Spiked Speedwell|Perennial|3-8|June-August|Full sun to part sun|Well draining, drought tolerant|Early spring every 3 years|Height: 24”, Spread: 24”, Clumping|Fragrant|Bees and Butterflies|Deer and rabbits|Second year, plants will show true leaf color|Long lived, long blooming|Good mildew resistance, good cut flower. Genus name honors Saint Veronica who reportedly gave a handkerchief to Jesus so he could wipe sweat from his face on the way to Calvary, with some genus plants having markings that resemble the markings on the sacred handkerchief|
